
    -----------------------------------------------------------------------
          Psi4: An Open-Source Ab Initio Electronic Structure Package
                               Psi4 1.10a1.dev76 

                         Git: Rev {master} 2b9265a 


    D. G. A. Smith, L. A. Burns, A. C. Simmonett, R. M. Parrish,
    M. C. Schieber, R. Galvelis, P. Kraus, H. Kruse, R. Di Remigio,
    A. Alenaizan, A. M. James, S. Lehtola, J. P. Misiewicz, M. Scheurer,
    R. A. Shaw, J. B. Schriber, Y. Xie, Z. L. Glick, D. A. Sirianni,
    J. S. O'Brien, J. M. Waldrop, A. Kumar, E. G. Hohenstein,
    B. P. Pritchard, B. R. Brooks, H. F. Schaefer III, A. Yu. Sokolov,
    K. Patkowski, A. E. DePrince III, U. Bozkaya, R. A. King,
    F. A. Evangelista, J. M. Turney, T. D. Crawford, C. D. Sherrill,
    J. Chem. Phys. 152(18) 184108 (2020). https://doi.org/10.1063/5.0006002

                            Additional Code Authors
    E. T. Seidl, C. L. Janssen, E. F. Valeev, M. L. Leininger,
    J. F. Gonthier, R. M. Richard, H. R. McAlexander, M. Saitow, X. Wang,
    P. Verma, M. H. Lechner, A. Jiang, S. Behnle, A. G. Heide,
    M. F. Herbst, and D. L. Poole

             Previous Authors, Complete List of Code Contributors,
                       and Citations for Specific Modules
    https://github.com/psi4/psi4/blob/master/codemeta.json
    https://github.com/psi4/psi4/graphs/contributors
    http://psicode.org/psi4manual/master/introduction.html#citing-psifour

    -----------------------------------------------------------------------


    Psi4 started on: Monday, 07 July 2025 10:02AM

    Process ID: 338092
    Host:       TUF
    PSIDATADIR: /usr/local/psi4/share/psi4
    Memory:     500.0 MiB
    Threads:    1
    
  ==> Input File <==

--------------------------------------------------------------------------
# Any line starting with the # character is a comment line
#! Sample HF/cc-pVDZ H2O computation

memory 600 mb   
import scf_lcom
import psi4

molecule h2o {
  O 
  H 1 0.96
  H 1 0.96 2 104.5
}

set basis cc-pVDZ

func1 = {
  "name": "func1",
  "coef": 1.0,
  "lcom_functionals":{
    "B3LYP": 1.0
  }
}

dft_functional1 = {
  "name": "test",
  "lcom_functionals":{
      "func1": func1, 
 }
}

set scf_lcom {
  print 1
}

print(psi4.driver.procedures['energy']['scf_lcom'])
E1 = energy('scf_lcom', dft_functional=dft_functional1, decompose_xc=False)
print(psi4.variable('DFT TOTAL ENERGY'))
E2 = energy('scf', dft_functional="B3LYP")
--------------------------------------------------------------------------

  Memory set to 572.205 MiB by Python driver.

Scratch directory: /home/kenrickmh/CHEM/psi4-scratch/
   => Libint2 <=

    Primary   basis highest AM E, G, H:  5, 4, 3
    Auxiliary basis highest AM E, G, H:  6, 5, 4
    Onebody   basis highest AM E, G, H:  6, 5, 4
    Solid Harmonics ordering:            Gaussian

*** tstart() called on TUF
*** at Mon Jul  7 10:02:54 2025

   => Loading Basis Set <=

    Name: CC-PVDZ
    Role: ORBITAL
    Keyword: BASIS
    atoms 1   entry O          line   198 file /usr/local/psi4/share/psi4/basis/cc-pvdz.gbs 
    atoms 2-3 entry H          line    22 file /usr/local/psi4/share/psi4/basis/cc-pvdz.gbs 


         ---------------------------------------------------------
                                   SCF
               by Justin Turney, Rob Parrish, Andy Simmonett
                          and Daniel G. A. Smith
                              RKS Reference
                        1 Threads,    572 MiB Core
         ---------------------------------------------------------

  ==> Geometry <==

    Molecular point group: c2v
    Full point group: C2v

    Geometry (in Angstrom), charge = 0, multiplicity = 1:

       Center              X                  Y                   Z               Mass       
    ------------   -----------------  -----------------  -----------------  -----------------
         O            0.000000000000     0.000000000000    -0.065775570547    15.994914619570
         H            0.000000000000    -0.759061990794     0.521953018286     1.007825032230
         H            0.000000000000     0.759061990794     0.521953018286     1.007825032230

  Running in c2v symmetry.

  Rotational constants: A =     27.26297  B =     14.51533  C =      9.47217 [cm^-1]
  Rotational constants: A = 817323.21126  B = 435158.60141  C = 283968.37536 [MHz]
  Nuclear repulsion =    9.168193296424349

  Charge       = 0
  Multiplicity = 1
  Electrons    = 10
  Nalpha       = 5
  Nbeta        = 5

  ==> Algorithm <==

  SCF Algorithm Type is DF.
  DIIS enabled.
  MOM disabled.
  Fractional occupation disabled.
  Guess Type is SAD.
  Energy threshold   = 1.00e-08
  Density threshold  = 1.00e-08
  Integral threshold = 1.00e-12

  ==> Primary Basis <==

  Basis Set: CC-PVDZ
    Blend: CC-PVDZ
    Number of shells: 12
    Number of basis functions: 24
    Number of Cartesian functions: 25
    Spherical Harmonics?: true
    Max angular momentum: 2

  ==> DFT Potential <==

   => LibXC <=

    Version 7.0.0
    S. Lehtola, C. Steigemann, M. J.T. Oliveira, and M. A.L. Marques.,  SoftwareX 7, 1–5 (2018) (10.1016/j.softx.2017.11.002)

   => Composite Functional: TEST <= 



    Deriv               =              1
    GGA                 =           TRUE
    Meta                =          FALSE

    Exchange Hybrid     =           TRUE
    MP2 Hybrid          =          FALSE

   => Exchange Functionals <=


   => Exact (HF) Exchange <=

    0.2000               HF 

   => Correlation Functionals <=

    1.0000   XC_HYB_GGA_XC_B3LYP

   => LibXC Density Thresholds  <==

    XC_HYB_GGA_XC_B3LYP:  1.00E-15 

   => Molecular Quadrature <=

    Radial Scheme          =       TREUTLER
    Pruning Scheme         =           NONE
    Nuclear Scheme         =       TREUTLER

    Blocking Scheme        =         OCTREE
    BS radius alpha        =              1
    Pruning alpha          =              1
    Radial Points          =             75
    Spherical Points       =            302
    Total Points           =          66186
    Total Blocks           =            554
    Max Points             =            256
    Max Functions          =             24
    Weights Tolerance      =       1.00E-15

   => Loading Basis Set <=

    Name: (CC-PVDZ AUX)
    Role: JKFIT
    Keyword: DF_BASIS_SCF
    atoms 1   entry O          line   221 file /usr/local/psi4/share/psi4/basis/cc-pvdz-jkfit.gbs 
    atoms 2-3 entry H          line    51 file /usr/local/psi4/share/psi4/basis/cc-pvdz-jkfit.gbs 

  ==> Integral Setup <==

  DFHelper Memory: AOs need 0.001 GiB; user supplied 0.373 GiB. 
  SCF_SUBTYPE=INCORE selected. In-core MEM_DF algorithm will be used.
  Using in-core AOs.

  ==> MemDFJK: Density-Fitted J/K Matrices <==

    J tasked:                   Yes
    K tasked:                   Yes
    wK tasked:                   No
    OpenMP threads:               1
    Memory [MiB]:               381
    Algorithm:                 Core
    Schwarz Cutoff:           1E-12
    Mask sparsity (%):       0.0000
    Fitting Condition:        1E-10

   => Auxiliary Basis Set <=

  Basis Set: (CC-PVDZ AUX)
    Blend: CC-PVDZ-JKFIT
    Number of shells: 42
    Number of basis functions: 116
    Number of Cartesian functions: 131
    Spherical Harmonics?: true
    Max angular momentum: 3

  Cached 100.0% of DFT collocation blocks in 0.046 [GiB].

  Minimum eigenvalue in the overlap matrix is 3.2707806872E-02.
  Reciprocal condition number of the overlap matrix is 1.0389988226E-02.
    Using symmetric orthogonalization.

  ==> Pre-Iterations <==

  SCF Guess: Superposition of Atomic Densities via on-the-fly atomic UHF (no occupation information).

   -------------------------
    Irrep   Nso     Nmo    
   -------------------------
     A1        11      11 
     A2         2       2 
     B1         4       4 
     B2         7       7 
   -------------------------
    Total      24      24
   -------------------------

  ==> Iterations <==

                           Total Energy        Delta E     RMS |[F,P]|

   @DF-RKS iter SAD:   -76.65551216820791   -7.66555e+01   0.00000e+00 
   @DF-RKS iter   1:   -76.37273762665465    2.82775e-01   2.24605e-02 DIIS/ADIIS
   @DF-RKS iter   2:   -76.38420542063150   -1.14678e-02   2.34788e-02 DIIS/ADIIS
   @DF-RKS iter   3:   -76.41873747928025   -3.45321e-02   5.07439e-03 DIIS/ADIIS
   @DF-RKS iter   4:   -76.42039700595336   -1.65953e-03   9.63296e-04 DIIS/ADIIS
   @DF-RKS iter   5:   -76.42045923605602   -6.22301e-05   2.80417e-05 DIIS
   @DF-RKS iter   6:   -76.42045929200097   -5.59450e-08   2.05667e-06 DIIS
   @DF-RKS iter   7:   -76.42045929231033   -3.09356e-10   4.62341e-08 DIIS
   @DF-RKS iter   8:   -76.42045929231054   -2.13163e-13   1.98453e-09 DIIS
  Energy and wave function converged.


  ==> Post-Iterations <==

   Electrons on quadrature grid:
      Ntotal   =   10.0000001670 ; deviation = 1.670e-07 

    Orbital Energies [Eh]
    ---------------------

    Doubly Occupied:                                                      

       1A1   -19.122451     2A1    -0.994149     1B2    -0.513083  
       3A1    -0.364496     1B1    -0.287840  

    Virtual:                                                              

       4A1     0.051564     2B2     0.127420     3B2     0.559891  
       5A1     0.612470     6A1     0.901489     2B1     0.918849  
       4B2     0.995061     7A1     1.204813     1A2     1.232830  
       3B1     1.427077     8A1     1.593342     5B2     1.668944  
       6B2     2.111796     9A1     2.148955     4B1     2.919858  
       2A2     2.964739    10A1     3.130747    11A1     3.465609  
       7B2     3.734956  

    Final Occupation by Irrep:
             A1    A2    B1    B2 
    DOCC [     3,    0,    1,    1 ]
    NA   [     3,    0,    1,    1 ]
    NB   [     3,    0,    1,    1 ]

  @DF-RKS Final Energy:   -76.42045929231054

   => Energetics <=

    Nuclear Repulsion Energy =              9.1681932964243487
    One-Electron Energy =                -123.1752796590533450
    Two-Electron Energy =                  45.1626793741264123
    DFT Exchange-Correlation Energy =      -7.5760523038079386
    Empirical Dispersion Energy =           0.0000000000000000
    VV10 Nonlocal Energy =                  0.0000000000000000
    Total Energy =                        -76.4204592923105253

Computation Completed


Properties will be evaluated at   0.000000,   0.000000,   0.000000 [a0]

Properties computed using the SCF density matrix


 Multipole Moments:

 ------------------------------------------------------------------------------------
     Multipole            Electronic (a.u.)      Nuclear  (a.u.)        Total (a.u.)
 ------------------------------------------------------------------------------------

 L = 1.  Multiply by 2.5417464519 to convert [e a0] to [Debye]
 Dipole X            :          0.0000000            0.0000000            0.0000000
 Dipole Y            :          0.0000000            0.0000000            0.0000000
 Dipole Z            :         -0.2263363            0.9783140            0.7519777
 Magnitude           :                                                    0.7519777

 ------------------------------------------------------------------------------------

*** tstop() called on TUF at Mon Jul  7 10:02:55 2025
Module time:
	user time   =       1.17 seconds =       0.02 minutes
	system time =       0.07 seconds =       0.00 minutes
	total time  =          1 seconds =       0.02 minutes
Total time:
	user time   =       1.17 seconds =       0.02 minutes
	system time =       0.07 seconds =       0.00 minutes
	total time  =          1 seconds =       0.02 minutes

Scratch directory: /home/kenrickmh/CHEM/psi4-scratch/
   => Libint2 <=

    Primary   basis highest AM E, G, H:  5, 4, 3
    Auxiliary basis highest AM E, G, H:  6, 5, 4
    Onebody   basis highest AM E, G, H:  6, 5, 4
    Solid Harmonics ordering:            Gaussian

*** tstart() called on TUF
*** at Mon Jul  7 10:02:55 2025

   => Loading Basis Set <=

    Name: CC-PVDZ
    Role: ORBITAL
    Keyword: BASIS
    atoms 1   entry O          line   198 file /usr/local/psi4/share/psi4/basis/cc-pvdz.gbs 
    atoms 2-3 entry H          line    22 file /usr/local/psi4/share/psi4/basis/cc-pvdz.gbs 


         ---------------------------------------------------------
                                   SCF
               by Justin Turney, Rob Parrish, Andy Simmonett
                          and Daniel G. A. Smith
                              RKS Reference
                        1 Threads,    572 MiB Core
         ---------------------------------------------------------

  ==> Geometry <==

    Molecular point group: c2v
    Full point group: C2v

    Geometry (in Angstrom), charge = 0, multiplicity = 1:

       Center              X                  Y                   Z               Mass       
    ------------   -----------------  -----------------  -----------------  -----------------
         O            0.000000000000     0.000000000000    -0.065775570547    15.994914619570
         H            0.000000000000    -0.759061990794     0.521953018286     1.007825032230
         H            0.000000000000     0.759061990794     0.521953018286     1.007825032230

  Running in c2v symmetry.

  Rotational constants: A =     27.26297  B =     14.51533  C =      9.47217 [cm^-1]
  Rotational constants: A = 817323.21126  B = 435158.60141  C = 283968.37536 [MHz]
  Nuclear repulsion =    9.168193296424349

  Charge       = 0
  Multiplicity = 1
  Electrons    = 10
  Nalpha       = 5
  Nbeta        = 5

  ==> Algorithm <==

  SCF Algorithm Type is DF.
  DIIS enabled.
  MOM disabled.
  Fractional occupation disabled.
  Guess Type is SAD.
  Energy threshold   = 1.00e-06
  Density threshold  = 1.00e-06
  Integral threshold = 1.00e-12

  ==> Primary Basis <==

  Basis Set: CC-PVDZ
    Blend: CC-PVDZ
    Number of shells: 12
    Number of basis functions: 24
    Number of Cartesian functions: 25
    Spherical Harmonics?: true
    Max angular momentum: 2

  ==> DFT Potential <==

   => LibXC <=

    Version 7.0.0
    S. Lehtola, C. Steigemann, M. J.T. Oliveira, and M. A.L. Marques.,  SoftwareX 7, 1–5 (2018) (10.1016/j.softx.2017.11.002)

   => Composite Functional: B3LYP <= 

    B3LYP Hyb-GGA Exchange-Correlation Functional

    P. J. Stephens, F. J. Devlin, C. F. Chabalowski, and M. J. Frisch.,  J. Phys. Chem. 98, 11623 (1994) (10.1021/j100096a001)

    Deriv               =              1
    GGA                 =           TRUE
    Meta                =          FALSE

    Exchange Hybrid     =           TRUE
    MP2 Hybrid          =          FALSE

   => Exchange Functionals <=

    0.0800   Slater exchange
    0.7200         Becke 88

   => Exact (HF) Exchange <=

    0.2000               HF 

   => Correlation Functionals <=

    0.1900   Vosko, Wilk & Nusair (VWN5_RPA)
    0.8100   Lee, Yang & Parr

   => LibXC Density Thresholds  <==

    XC_HYB_GGA_XC_B3LYP:  1.00E-15 

   => Molecular Quadrature <=

    Radial Scheme          =       TREUTLER
    Pruning Scheme         =           NONE
    Nuclear Scheme         =       TREUTLER

    Blocking Scheme        =         OCTREE
    BS radius alpha        =              1
    Pruning alpha          =              1
    Radial Points          =             75
    Spherical Points       =            302
    Total Points           =          66186
    Total Blocks           =            554
    Max Points             =            256
    Max Functions          =             24
    Weights Tolerance      =       1.00E-15

   => Loading Basis Set <=

    Name: (CC-PVDZ AUX)
    Role: JKFIT
    Keyword: DF_BASIS_SCF
    atoms 1   entry O          line   221 file /usr/local/psi4/share/psi4/basis/cc-pvdz-jkfit.gbs 
    atoms 2-3 entry H          line    51 file /usr/local/psi4/share/psi4/basis/cc-pvdz-jkfit.gbs 

  ==> Integral Setup <==

  DFHelper Memory: AOs need 0.001 GiB; user supplied 0.373 GiB. 
  SCF_SUBTYPE=INCORE selected. In-core MEM_DF algorithm will be used.
  Using in-core AOs.

  ==> MemDFJK: Density-Fitted J/K Matrices <==

    J tasked:                   Yes
    K tasked:                   Yes
    wK tasked:                   No
    OpenMP threads:               1
    Memory [MiB]:               381
    Algorithm:                 Core
    Schwarz Cutoff:           1E-12
    Mask sparsity (%):       0.0000
    Fitting Condition:        1E-10

   => Auxiliary Basis Set <=

  Basis Set: (CC-PVDZ AUX)
    Blend: CC-PVDZ-JKFIT
    Number of shells: 42
    Number of basis functions: 116
    Number of Cartesian functions: 131
    Spherical Harmonics?: true
    Max angular momentum: 3

  Cached 100.0% of DFT collocation blocks in 0.046 [GiB].

  Minimum eigenvalue in the overlap matrix is 3.2707806872E-02.
  Reciprocal condition number of the overlap matrix is 1.0389988226E-02.
    Using symmetric orthogonalization.

  ==> Pre-Iterations <==

  SCF Guess: Superposition of Atomic Densities via on-the-fly atomic UHF (no occupation information).

   -------------------------
    Irrep   Nso     Nmo    
   -------------------------
     A1        11      11 
     A2         2       2 
     B1         4       4 
     B2         7       7 
   -------------------------
    Total      24      24
   -------------------------

  ==> Iterations <==

                           Total Energy        Delta E     RMS |[F,P]|

   @DF-RKS iter SAD:   -76.65551216820791   -7.66555e+01   0.00000e+00 
   @DF-RKS iter   1:   -76.37273762665465    2.82775e-01   2.24605e-02 DIIS/ADIIS
   @DF-RKS iter   2:   -76.38420542063150   -1.14678e-02   2.34788e-02 DIIS/ADIIS
   @DF-RKS iter   3:   -76.41873747928025   -3.45321e-02   5.07439e-03 DIIS/ADIIS
   @DF-RKS iter   4:   -76.42039700595336   -1.65953e-03   9.63296e-04 DIIS/ADIIS
   @DF-RKS iter   5:   -76.42045923605602   -6.22301e-05   2.80417e-05 DIIS
   @DF-RKS iter   6:   -76.42045929200097   -5.59450e-08   2.05667e-06 DIIS
   @DF-RKS iter   7:   -76.42045929231033   -3.09356e-10   4.62341e-08 DIIS
  Energy and wave function converged.


  ==> Post-Iterations <==

   Electrons on quadrature grid:
      Ntotal   =   10.0000001670 ; deviation = 1.670e-07 

    Orbital Energies [Eh]
    ---------------------

    Doubly Occupied:                                                      

       1A1   -19.122451     2A1    -0.994149     1B2    -0.513083  
       3A1    -0.364496     1B1    -0.287840  

    Virtual:                                                              

       4A1     0.051564     2B2     0.127420     3B2     0.559891  
       5A1     0.612470     6A1     0.901489     2B1     0.918849  
       4B2     0.995061     7A1     1.204813     1A2     1.232830  
       3B1     1.427077     8A1     1.593342     5B2     1.668944  
       6B2     2.111796     9A1     2.148955     4B1     2.919858  
       2A2     2.964739    10A1     3.130747    11A1     3.465609  
       7B2     3.734956  

    Final Occupation by Irrep:
             A1    A2    B1    B2 
    DOCC [     3,    0,    1,    1 ]
    NA   [     3,    0,    1,    1 ]
    NB   [     3,    0,    1,    1 ]

  @DF-RKS Final Energy:   -76.42045929231033

   => Energetics <=

    Nuclear Repulsion Energy =              9.1681932964243487
    One-Electron Energy =                -123.1752818326948500
    Two-Electron Energy =                  45.1626817688927531
    DFT Exchange-Correlation Energy =      -7.5760525249325781
    Empirical Dispersion Energy =           0.0000000000000000
    VV10 Nonlocal Energy =                  0.0000000000000000
    Total Energy =                        -76.4204592923103263

Computation Completed


Properties will be evaluated at   0.000000,   0.000000,   0.000000 [a0]

Properties computed using the SCF density matrix


 Multipole Moments:

 ------------------------------------------------------------------------------------
     Multipole            Electronic (a.u.)      Nuclear  (a.u.)        Total (a.u.)
 ------------------------------------------------------------------------------------

 L = 1.  Multiply by 2.5417464519 to convert [e a0] to [Debye]
 Dipole X            :          0.0000000            0.0000000            0.0000000
 Dipole Y            :          0.0000000            0.0000000            0.0000000
 Dipole Z            :         -0.2263363            0.9783140            0.7519777
 Magnitude           :                                                    0.7519777

 ------------------------------------------------------------------------------------

*** tstop() called on TUF at Mon Jul  7 10:02:56 2025
Module time:
	user time   =       0.88 seconds =       0.01 minutes
	system time =       0.04 seconds =       0.00 minutes
	total time  =          1 seconds =       0.02 minutes
Total time:
	user time   =       2.13 seconds =       0.04 minutes
	system time =       0.12 seconds =       0.00 minutes
	total time  =          2 seconds =       0.03 minutes

    Psi4 stopped on: Monday, 07 July 2025 10:02AM
    Psi4 wall time for execution: 0:00:02.40

*** Psi4 exiting successfully. Buy a developer a beer!
